<?xml version="1.0" encoding="UTF-8" ?>

<level-pack name="Classic" xmlns:xsi="http://www.w3.org/2001/XMLSchema-instance"
            xsi:noNamespaceSchemaLocation="level-pack-schema.xsd">
    <level number="1" completed="false">
        <game-field>
            <column>
                <empty />
                <empty />
            </column>
            <column>
                <finish />
                <start  />
            </column>
        </game-field>
    </level>

    <level number="2" completed="false">
        <game-field>
            <column>
                <empty />
                <empty />
                <empty />
            </column>
            <column>
                <empty />
                <wall  />
                <empty />
            </column>
            <column>
                <start  />
                <finish />
                <empty  />
            </column>
        </game-field>
    </level>

    <level number="3" completed="false">
        <game-field>
            <column>
                <wall   />
                <empty  />
                <empty  />
            </column>
            <column>
                <empty  />
                <empty  />
                <empty  />
            </column>
            <column>
                <start  />
                <wall   />
                <finish />
            </column>
        </game-field>
    </level>

    <level number="4" completed="false">
        <game-field>
            <column>
                <empty  />
                <empty  />
                <wall   />
                <wall   />
            </column>
            <column>
                <empty  />
                <empty  />
                <empty  />
                <empty  />
            </column>
            <column>
                <empty  />
                <wall   />
                <wall   />
                <empty  />
            </column>
            <column>
                <start  />
                <finish />
                <empty  />
                <empty  />
            </column>
        </game-field>
    </level>

    <level number="5" completed="false">
        <game-field>
            <column>
                <wall   />
                <empty  />
                <empty  />
                <empty  />
                <start  />
            </column>
            <column>
                <empty  />
                <empty  />
                <empty  />
                <empty  />
                <wall   />
            </column>
            <column>
                <empty  />
                <wall   />
                <empty  />
                <empty  />
                <empty  />
            </column>
            <column>
                <empty  />
                <empty  />
                <empty  />
                <wall   />
                <empty  />
            </column>
            <column>
                <empty  />
                <empty  />
                <wall   />
                <finish />
                <empty  />
            </column>
        </game-field>
    </level>
</level-pack>
