<?xml version="1.0" encoding="UTF-8" ?>

<level-pack name="classic" xmlns:xsi="http://www.w3.org/2001/XMLSchema-instance"
            xsi:noNamespaceSchemaLocation="level-pack-schema.xsd">
    <level name="first steps" number="1">
        <game-field>
            <column>
                <wall   />
                <empty  />
                <empty  />
            </column>
            <column>
                <empty  />
                <empty  />
                <empty  />
            </column>
            <column>
                <start  />
                <wall   />
                <finish />
            </column>
        </game-field>
    </level>

    <level name="err..." number="2">
        <game-field>
            <column>
                <wall  />
                <empty />
                <empty />
                <empty />
                <start />
            </column>
            <column>
                <empty  />
                <empty  />
                <empty  />
                <empty  />
                <wall   />
            </column>
            <column>
                <empty  />
                <wall   />
                <empty  />
                <empty  />
                <empty  />
            </column>
            <column>
                <empty  />
                <empty  />
                <empty  />
                <wall   />
                <empty  />
            </column>
            <column>
                <empty  />
                <empty  />
                <wall   />
                <finish />
                <empty  />
            </column>
        </game-field>
    </level>
</level-pack>
